{
  "schema_version": "2.0",
  "run_id": "20260916T165000Z_AbyssalReefLE_deadbeef",
  "seq": 2,
  "game_loop": 224,
  "game_time_s": 10.0,
  "source": "bot",
  "event_type": "chat",
  "speaker": "playbot",
  "message": "Playbot online \u2014 holding the line.",
  "player_id": 1,
  "logged_at_utc": "2026-09-16T16:50:10Z"
}
